<?xml version="1.0" encoding="UTF-8"?>
<xs:schema xmlns:xs="http://www.w3.org/2001/XMLSchema" targetNamespace="http://www.uts.edu.au/31284/wsd-diary" 
    xmlns="http://www.uts.edu.au/31284/wsd-diary" elementFormDefault="qualified">    <!-- Insert your type declarations here -->
    <xs:simpleType name="ratingType">
        <xs:restriction base="xs:integer">
            <xs:minInclusive value="1" />
            <xs:maxInclusive value="5"/>
        </xs:restriction>
    </xs:simpleType>
    <xs:simpleType name="dateType">
        <xs:restriction base="xs:string">
            <xs:pattern value="\d{1,2}/\d{1,2}/\d{1,4}"/>
        </xs:restriction>
    </xs:simpleType>
    <xs:simpleType name="nameType">
        <xs:restriction base="xs:string">
            <xs:pattern value="[A-Z][a-zA-Z ]*"/>
        </xs:restriction>
    </xs:simpleType>
    <xs:simpleType name="emailType">
        <xs:restriction base="xs:string">
            <xs:pattern value="[a-zA-Z.]*@[a-z]{2,7}\\.[a-z]{2,6}"/>
        </xs:restriction>
    </xs:simpleType>
    <xs:element name="diary">
        <xs:complexType>
            <xs:sequence>
                <xs:element name="profile" minOccurs="0" maxOccurs="1">
                    <xs:complexType>
                        <xs:sequence>
                            <xs:element name="name" type="nameType"/>
                            <xs:element name="introduction" type="xs:string"/>
                            <xs:element name="dob" type="dateType"/>
                            <xs:element name="email" type="xs:string"/>
                            <xs:element name="interests" minOccurs="0" maxOccurs="1">
                                <xs:complexType>
                                    <xs:sequence>
                                        <xs:element name="interest" minOccurs="0" maxOccurs="unbounded">
                                            <xs:complexType>
                                                <xs:sequence>
                                                    <xs:element name="name" type="xs:string"/>
                                                    <xs:element name="description" type="xs:string"/>
                                                </xs:sequence>
                                            </xs:complexType>
                                        </xs:element>
                                    </xs:sequence>
                                </xs:complexType>
                            </xs:element>
                        </xs:sequence>
                    </xs:complexType>
                </xs:element>
                <xs:element name="entry" maxOccurs="unbounded">
                    <xs:complexType>
                        <xs:sequence>
                            <xs:element name="date" type="dateType"/>
                            <xs:element name="title" type="xs:string"/>
                            <xs:element name="rating" type="ratingType"/>
                            <xs:element name="body" type="xs:string"/>
                        </xs:sequence>
                    </xs:complexType>
                </xs:element>
            </xs:sequence>
        </xs:complexType>
    </xs:element>
</xs:schema>