<?xml version="1.0" encoding="UTF-8"?>
<diary xmlns="http://www.uts.edu.au/31284/wsd-diary" 
    xmlns:xsi="http://www.w3.org/2001/XMLSchema-instance" xsi:schemaLocation="http://www.uts.edu.au/31284/wsd-diary diary.xsd">

    <profile>
        <name>Sammy Kohg</name>
        <introduction>  
            Hi, I'm Sammy and I'm an IT student at the University of Technology, Sydney.
            I'm originally from Germany, and I decided to start this diary to practice
            my English.
        </introduction>
        <dob>1/1/2000</dob>
        <email>Sammy.Kohg@gmail.com</email>
        <interests>
            <interest>
                <name>Football</name>
                <description>A ball game.</description>
            </interest>
            <interest>
                <name>TV</name>
                <description>I like to watch the football show.</description>
            </interest>
        </interests>
    </profile>
    <entry>
        <date>15/9/2012</date>
        <title>I bought a new phone</title>
        <rating>3</rating>
        <body>
            Today I bought a Galaxy S III to replace my old iPhone.
        </body>
    </entry>
    <entry>
        <date>16/10/2012</date>
        <title>Busy day</title>
        <rating>5</rating>
        <body>
            I have 3 assignments due today. I need coffee!
        </body>
    </entry>
</diary>